{
  "name": "ARC56Test",
  "desc": "",
  "methods": [
    {
      "name": "foo",
      "args": [
        {
          "name": "inputs",
          "type": "((uint64,uint64),(uint64,uint64))",
          "struct": "Inputs"
        }
      ],
      "returns": {
        "type": "(uint64,uint64)",
        "struct": "Outputs"
      },
      "actions": {
        "create": [],
        "call": ["NoOp"]
      }
    },
    {
      "name": "optInToApplication",
      "args": [],
      "returns": {
        "type": "void"
      },
      "actions": {
        "create": [],
        "call": ["OptIn"]
      }
    },
    {
      "name": "createApplication",
      "args": [],
      "returns": {
        "type": "void"
      },
      "actions": {
        "create": ["NoOp"],
        "call": []
      }
    }
  ],
  "arcs": [4, 56],
  "structs": {
    "{ foo: uint16; bar: uint16 }": [
      {
        "name": "foo",
        "type": "uint16"
      },
      {
        "name": "bar",
        "type": "uint16"
      }
    ],
    "Outputs": [
      {
        "name": "sum",
        "type": "uint64"
      },
      {
        "name": "difference",
        "type": "uint64"
      }
    ],
    "Inputs": [
      {
        "name": "add",
        "type": [
          {
            "name": "a",
            "type": "uint64"
          },
          {
            "name": "b",
            "type": "uint64"
          }
        ]
      },
      {
        "name": "subtract",
        "type": [
          {
            "name": "a",
            "type": "uint64"
          },
          {
            "name": "b",
            "type": "uint64"
          }
        ]
      }
    ]
  },
  "state": {
    "schema": {
      "global": {
        "bytes": 37,
        "ints": 1
      },
      "local": {
        "bytes": 13,
        "ints": 1
      }
    },
    "keys": {
      "global": {
        "globalKey": {
          "key": "Z2xvYmFsS2V5",
          "keyType": "AVMBytes",
          "valueType": "uint64"
        }
      },
      "local": {
        "localKey": {
          "key": "bG9jYWxLZXk=",
          "keyType": "AVMBytes",
          "valueType": "uint64"
        }
      },
      "box": {
        "boxKey": {
          "key": "Ym94S2V5",
          "keyType": "AVMBytes",
          "valueType": "string"
        }
      }
    },
    "maps": {
      "global": {
        "globalMap": {
          "keyType": "string",
          "valueType": "{ foo: uint16; bar: uint16 }",
          "prefix": "cA=="
        }
      },
      "local": {
        "localMap": {
          "keyType": "AVMBytes",
          "valueType": "string",
          "prefix": "cA=="
        }
      },
      "box": {
        "boxMap": {
          "keyType": "Inputs",
          "valueType": "Outputs",
          "prefix": "cA=="
        }
      }
    }
  },
  "bareActions": {
    "create": [],
    "call": []
  },
  "sourceInfo": {
    "approval": {
      "sourceInfo": [
        {
          "teal": 15,
          "source": "examples/arc56_test/arc56_test.algo.ts:11",
          "pc": [1, 2]
        },
        {
          "teal": 16,
          "source": "examples/arc56_test/arc56_test.algo.ts:11",
          "pc": [3]
        },
        {
          "teal": 17,
          "source": "examples/arc56_test/arc56_test.algo.ts:11",
          "pc": [4, 5]
        },
        {
          "teal": 18,
          "source": "examples/arc56_test/arc56_test.algo.ts:11",
          "pc": [6]
        },
        {
          "teal": 19,
          "source": "examples/arc56_test/arc56_test.algo.ts:11",
          "pc": [7, 8]
        },
        {
          "teal": 20,
          "source": "examples/arc56_test/arc56_test.algo.ts:11",
          "pc": [9]
        },
        {
          "teal": 21,
          "source": "examples/arc56_test/arc56_test.algo.ts:11",
          "pc": [10, 11, 12, 13, 14, 15, 16, 17, 18, 19, 20, 21, 22, 23, 24, 25, 26, 27, 28, 29, 30, 31, 32, 33, 34, 35]
        },
        {
          "teal": 25,
          "source": "examples/arc56_test/arc56_test.algo.ts:11",
          "errorMessage": "The requested action is not implemented in this contract. Are you using the correct OnComplete? Did you set your app ID?",
          "pc": [36]
        },
        {
          "teal": 30,
          "source": "examples/arc56_test/arc56_test.algo.ts:29",
          "pc": [37, 38, 39, 40, 41, 42]
        },
        {
          "teal": 33,
          "source": "examples/arc56_test/arc56_test.algo.ts:29",
          "pc": [43, 44, 45]
        },
        {
          "teal": 34,
          "source": "examples/arc56_test/arc56_test.algo.ts:29",
          "pc": [46]
        },
        {
          "teal": 35,
          "source": "examples/arc56_test/arc56_test.algo.ts:29",
          "pc": [47]
        },
        {
          "teal": 36,
          "source": "examples/arc56_test/arc56_test.algo.ts:29",
          "pc": [48, 49]
        },
        {
          "teal": 37,
          "source": "examples/arc56_test/arc56_test.algo.ts:29",
          "pc": [50]
        },
        {
          "teal": 40,
          "source": "examples/arc56_test/arc56_test.algo.ts:29",
          "errorMessage": "argument 0 (inputs) for foo must be a ((uint64,uint64),(uint64,uint64))",
          "pc": [51]
        },
        {
          "teal": 43,
          "source": "examples/arc56_test/arc56_test.algo.ts:29",
          "pc": [52, 53, 54]
        },
        {
          "teal": 44,
          "source": "examples/arc56_test/arc56_test.algo.ts:29",
          "pc": [55]
        },
        {
          "teal": 45,
          "source": "examples/arc56_test/arc56_test.algo.ts:29",
          "pc": [56]
        },
        {
          "teal": 46,
          "source": "examples/arc56_test/arc56_test.algo.ts:29",
          "pc": [57]
        },
        {
          "teal": 47,
          "source": "examples/arc56_test/arc56_test.algo.ts:29",
          "pc": [58]
        },
        {
          "teal": 51,
          "source": "examples/arc56_test/arc56_test.algo.ts:29",
          "pc": [59, 60, 61]
        },
        {
          "teal": 56,
          "source": "examples/arc56_test/arc56_test.algo.ts:30",
          "pc": [62, 63]
        },
        {
          "teal": 57,
          "source": "examples/arc56_test/arc56_test.algo.ts:30",
          "pc": [64, 65, 66]
        },
        {
          "teal": 58,
          "source": "examples/arc56_test/arc56_test.algo.ts:30",
          "pc": [67]
        },
        {
          "teal": 59,
          "source": "examples/arc56_test/arc56_test.algo.ts:30",
          "pc": [68, 69]
        },
        {
          "teal": 60,
          "source": "examples/arc56_test/arc56_test.algo.ts:30",
          "pc": [70, 71, 72]
        },
        {
          "teal": 61,
          "source": "examples/arc56_test/arc56_test.algo.ts:30",
          "pc": [73]
        },
        {
          "teal": 62,
          "source": "examples/arc56_test/arc56_test.algo.ts:30",
          "pc": [74]
        },
        {
          "teal": 63,
          "source": "examples/arc56_test/arc56_test.algo.ts:30",
          "pc": [75, 76, 77]
        },
        {
          "teal": 67,
          "source": "examples/arc56_test/arc56_test.algo.ts:30",
          "errorMessage": "subtract.a must be greater than subtract.b",
          "pc": [78]
        },
        {
          "teal": 72,
          "source": "examples/arc56_test/arc56_test.algo.ts:32",
          "pc": [79, 80, 81, 82, 83, 84, 85, 86, 87, 88, 89]
        },
        {
          "teal": 73,
          "source": "examples/arc56_test/arc56_test.algo.ts:32",
          "pc": [90]
        },
        {
          "teal": 74,
          "source": "examples/arc56_test/arc56_test.algo.ts:32",
          "pc": [91]
        },
        {
          "teal": 78,
          "source": "examples/arc56_test/arc56_test.algo.ts:33",
          "pc": [92, 93, 94, 95, 96, 97, 98, 99]
        },
        {
          "teal": 79,
          "source": "examples/arc56_test/arc56_test.algo.ts:33",
          "pc": [100, 101, 102, 103, 104, 105]
        },
        {
          "teal": 80,
          "source": "examples/arc56_test/arc56_test.algo.ts:33",
          "pc": [106]
        },
        {
          "teal": 87,
          "source": "examples/arc56_test/arc56_test.algo.ts:36",
          "pc": [107, 108]
        },
        {
          "teal": 88,
          "source": "examples/arc56_test/arc56_test.algo.ts:36",
          "pc": [109, 110, 111]
        },
        {
          "teal": 89,
          "source": "examples/arc56_test/arc56_test.algo.ts:36",
          "pc": [112]
        },
        {
          "teal": 90,
          "source": "examples/arc56_test/arc56_test.algo.ts:36",
          "pc": [113, 114]
        },
        {
          "teal": 91,
          "source": "examples/arc56_test/arc56_test.algo.ts:36",
          "pc": [115, 116, 117]
        },
        {
          "teal": 92,
          "source": "examples/arc56_test/arc56_test.algo.ts:36",
          "pc": [118]
        },
        {
          "teal": 93,
          "source": "examples/arc56_test/arc56_test.algo.ts:36",
          "pc": [119]
        },
        {
          "teal": 94,
          "source": "examples/arc56_test/arc56_test.algo.ts:36",
          "pc": [120]
        },
        {
          "teal": 95,
          "source": "examples/arc56_test/arc56_test.algo.ts:37",
          "pc": [121, 122]
        },
        {
          "teal": 96,
          "source": "examples/arc56_test/arc56_test.algo.ts:37",
          "pc": [123, 124, 125]
        },
        {
          "teal": 97,
          "source": "examples/arc56_test/arc56_test.algo.ts:37",
          "pc": [126]
        },
        {
          "teal": 98,
          "source": "examples/arc56_test/arc56_test.algo.ts:37",
          "pc": [127, 128]
        },
        {
          "teal": 99,
          "source": "examples/arc56_test/arc56_test.algo.ts:37",
          "pc": [129, 130, 131]
        },
        {
          "teal": 100,
          "source": "examples/arc56_test/arc56_test.algo.ts:37",